{
  "project_id": "example_history",
  "source": "examples\\example_history.bas",
  "history_item_count": 12,
  "classified_commands": [
    {
      "index": 1,
      "raw_name": "set project units",
      "category": "project",
      "subcategory": "units",
      "confidence": 0.95,
      "evidence": [
        "sets project units",
        "matched /\\bwith\\s+units\\b/"
      ],
      "raw_macro_excerpt": "' History Item: set project units\nWith Units\n     .SetUnit \"Length\", \"mm\"\n     .SetUnit \"Frequency\", \"GHz\"\n     .SetUnit \"Time\", \"ns\"\n     .SetUnit \"Temperature\", \"K\"\nEnd With"
    },
    {
      "index": 2,
      "raw_name": "store cavity parameters",
      "category": "project",
      "subcategory": "parameters",
      "confidence": 0.9,
      "evidence": [
        "sets project parameter",
        "matched /\\bstoreparameter\\b/"
      ],
      "raw_macro_excerpt": "' History Item: store cavity parameters\nStoreParameter \"cavity_radius\", \"42.0\"\nStoreParameter \"cell_length\", \"115.0\""
    },
    {
      "index": 3,
      "raw_name": "define copper material",
      "category": "material",
      "subcategory": "material_definition",
      "confidence": 0.95,
      "evidence": [
        "defines material",
        "matched /\\bwith\\s+material\\b/"
      ],
      "raw_macro_excerpt": "' History Item: define copper material\nWith Material\n     .Reset\n     .Name \"OFHC_Copper\"\n     .Folder \"CavityMaterials\"\n     .Type \"Normal\"\n     .Epsilon \"1.0\"\n     .Mu \"1.0\"\n     .Sigma \"5.8e7\"\n     .Create\nEnd With"
    },
    {
      "index": 4,
      "raw_name": "import baseline geometry",
      "category": "geometry",
      "subcategory": "import",
      "confidence": 0.9,
      "evidence": [
        "imports geometry",
        "matched /\\bwith\\s+(step|sat|iges|stl|acis)\\b/"
      ],
      "raw_macro_excerpt": "' History Item: import baseline geometry\nWith STEP\n     .Reset\n     .FileName \"baseline_cavity.step\"\n     .ScaleToUnit \"False\"\n     .ImportToActiveCoordinateSystem \"True\"\n     .Import\nEnd With"
    },
    {
      "index": 5,
      "raw_name": "create vacuum cylinder",
      "category": "geometry",
      "subcategory": "primitive_creation",
      "confidence": 0.88,
      "evidence": [
        "creates primitive geometry",
        "matched /\\bwith\\s+(brick|cylinder|sphere|cone|torus|extrude|loft|wire|curve)\\b/"
      ],
      "raw_macro_excerpt": "' History Item: create vacuum cylinder\nWith Cylinder\n     .Reset\n     .Name \"rf_vacuum\"\n     .Component \"vacuum\"\n     .Material \"Vacuum\"\n     .OuterRadius \"20\"\n     .Zrange \"-50\", \"50\"\n     .Create\nEnd With"
    },
    {
      "index": 6,
      "raw_name": "global boundary conditions",
      "category": "boundary",
      "subcategory": "global_boundary",
      "confidence": 0.9,
      "evidence": [
        "sets global boundary",
        "matched /\\bwith\\s+boundary\\b/"
      ],
      "raw_macro_excerpt": "' History Item: global boundary conditions\nWith Boundary\n     .Xmin \"electric\"\n     .Xmax \"electric\"\n     .Ymin \"electric\"\n     .Ymax \"electric\"\n     .Zmin \"magnetic\"\n     .Zmax \"open\"\n     .ApplyInAllDirections \"False\"\nEnd With"
    },
    {
      "index": 7,
      "raw_name": "waveguide input port",
      "category": "ports",
      "subcategory": "waveguide_port",
      "confidence": 0.9,
      "evidence": [
        "defines waveguide or generic CST port",
        "matched /\\bwith\\s+waveguideport\\b/"
      ],
      "raw_macro_excerpt": "' History Item: waveguide input port\nWith WaveguidePort\n     .Reset\n     .PortNumber \"1\"\n     .Label \"input_coupler\"\n     .NumberOfModes \"1\"\n     .AdjustPolarization \"False\"\n     .Create\nEnd With"
    },
    {
      "index": 8,
      "raw_name": "global mesh setup",
      "category": "mesh",
      "subcategory": "global_mesh",
      "confidence": 0.82,
      "evidence": [
        "sets global mesh",
        "matched /\\bwith\\s+mesh\\b/"
      ],
      "raw_macro_excerpt": "' History Item: global mesh setup\nWith Mesh\n     .Reset\n     .LinesPerWavelength \"20\"\n     .MinimumStepNumber \"5\"\n     .UseRatioLimit \"True\"\nEnd With"
    },
    {
      "index": 9,
      "raw_name": "eigenmode solver settings",
      "category": "solver",
      "subcategory": "eigenmode_solver",
      "confidence": 0.95,
      "evidence": [
        "sets eigenmode solver",
        "matched /\\beigenmodesolver\\b/"
      ],
      "raw_macro_excerpt": "' History Item: eigenmode solver settings\nChangeSolverType \"Eigenmode\"\nWith EigenmodeSolver\n     .Reset\n     .Modes \"5\"\n     .Accuracy \"1e-6\"\n     .StoreResultsInCache \"False\"\nEnd With"
    },
    {
      "index": 10,
      "raw_name": "e field monitor",
      "category": "monitors",
      "subcategory": "e_field_monitor",
      "confidence": 0.9,
      "evidence": [
        "defines E-field monitor",
        "matched /\\be[-_ ]?field\\b/"
      ],
      "raw_macro_excerpt": "' History Item: e field monitor\nWith Monitor\n     .Reset\n     .Name \"E-field 1.3GHz\"\n     .Domain \"Frequency\"\n     .FieldType \"Efield\"\n     .Frequency \"1.3\"\n     .Create\nEnd With"
    },
    {
      "index": 11,
      "raw_name": "result template q factor",
      "category": "results",
      "subcategory": "result_template",
      "confidence": 0.9,
      "evidence": [
        "defines result template or storage",
        "matched /\\bresulttemplate\\b/"
      ],
      "raw_macro_excerpt": "' History Item: result template q factor\nWith ResultTemplate\n     .Reset\n     .Name \"Q Factor\"\n     .Type \"0D\"\n     .Evaluate\nEnd With"
    },
    {
      "index": 12,
      "raw_name": "export 3d fields",
      "category": "results",
      "subcategory": "export_3d",
      "confidence": 0.86,
      "evidence": [
        "exports 3D result",
        "matched /\\bfieldexport\\b/"
      ],
      "raw_macro_excerpt": "' History Item: export 3d fields\nWith FieldExport\n     .Reset\n     .FileName \"exports/e_field_mode1.h5\"\n     .Mode \"FixedNumber\"\n     .Step \"1\"\n     .Execute\nEnd With"
    }
  ],
  "unknown_commands": []
}
